{
  "task_id": "ck-b200",
  "title": "Retain grown schema fields",
  "model": "claude:haiku",
  "suggested_model": "opus",
  "branch": "council/grown-schema-task/ck-b200",
  "worktree": "council/ts/test/fixtures/python-runs/.worktrees/grown-schema-task/ck-b200",
  "committed": true,
  "summary": "{\"approach\": \"Use deterministic canned model output.\", \"engine\": {\"label\": \"claude:haiku\"}, \"model_tier\": \"fixture\", \"open_questions\": [], \"parallelizable_tasks\": [\"ck-b200\"], \"risks\": [], \"steps\": [\"plan\", \"fanout\"], \"summary\": \"grown-schema-task plan from claude:haiku\"}",
  "files_changed": [
    "schema/grown.json"
  ],
  "out_of_bounds": [],
  "verify_rc": 0,
  "verify_output": "fixture verify ok",
  "verdict": {
    "satisfied": true,
    "reasons": "fixture",
    "issues": []
  },
  "status": "ok"
}