{
  "task_id": "ck-a100",
  "title": "Touch watchdog table config",
  "model": "claude:haiku",
  "suggested_model": "haiku",
  "branch": "council/watchdog-table-config/ck-a100",
  "worktree": "council/ts/test/fixtures/python-runs/.worktrees/watchdog-table-config/ck-a100",
  "committed": true,
  "summary": "{\"approach\": \"Use deterministic canned model output.\", \"engine\": {\"label\": \"claude:haiku\"}, \"model_tier\": \"fixture\", \"open_questions\": [], \"parallelizable_tasks\": [\"ck-a100\"], \"risks\": [], \"steps\": [\"plan\", \"fanout\"], \"summary\": \"watchdog-table-config plan from claude:haiku\"}",
  "files_changed": [
    "config/service.toml"
  ],
  "out_of_bounds": [],
  "verify_rc": 0,
  "verify_output": "fixture verify ok",
  "verdict": {
    "satisfied": true,
    "reasons": "fixture",
    "issues": []
  },
  "status": "ok"
}